Question,co:ltd,co:plc,sh,lang:de,lang:en
What is the difference between LTD and PLC?,1,1,0,0,1
What is difference between limited company and unlimited company?,1,1,0,0,1
Why would a private limited company change to a public limited company?,1,1,0,0,1
What are the advantages of a PLC company?,0,1,0,0,1
What are the disadvantages of a PLC?,0,1,0,0,1
Is Apple a PLC or Ltd?,1,1,0,0,1
What does a Ltd company mean?,1,0,0,0,1
What are the disadvantages of private limited company?,1,0,0,0,1
What are some examples of private limited companies?,1,0,0,0,1
What are the types of limited companies?,1,1,0,0,1
What is the difference between a Ltd and LLC?,1,0,0,0,1
What is the opposite of a limited company?,1,1,0,0,1
What does Ltd and PLC mean?,1,1,0,0,1
Who owns a Ltd company?,1,0,0,0,1
Is a Ltd company private or public?,1,0,0,0,1
Is a Ltd company a corporation?,1,0,0,0,1
Why Limited is used in company name?,1,0,0,0,1
How does a Pty Ltd company work?,1,0,0,0,1
How many directors does a Ltd company need?,1,0,0,0,1
Can directors be personally liable in a limited company?,1,0,0,0,1
Do Ltd companies have shareholders?,1,0,1,0,1
What does Ltd mean?,1,0,0,0,1
What is limited liability in business?,1,1,0,0,1
Are all limited companies listed?,1,1,0,0,1
What is the difference between LP and LTD?,1,0,0,0,1
Is it worth becoming a Ltd company?,1,0,0,0,1
What type of company is a Ltd company?,1,0,0,0,1
What is an example of a limited company?,1,0,0,0,1
What is the difference between a limited company and an unlimited company?,1,1,0,0,1
What are the two types of limited company?,1,1,0,0,1
Is Mcdonalds a private limited company?,1,0,0,0,1
What are the disadvantages of Ltd?,1,0,0,0,1
What is the advantage and disadvantage of private limited company?,1,0,0,0,1
What are the benefits of having a limited company?,1,0,0,0,1
What is the difference between an LLC and a Ltd?,1,0,0,0,1
Is a sole trader a limited company?,1,0,0,0,1
What are the disadvantages of a private limited company?,1,0,0,0,1
What is PLC and its advantages?,0,1,0,0,1
Why do private limited companies fail?,1,0,0,0,1
What happens if a Ltd company goes bust?,1,0,0,0,1
What is PLC and its function?,1,0,0,0,1
How many types of PLC are there?,1,0,0,0,1
Why is PLC used?,1,0,0,0,1
Which is better partnership or private limited company?,1,0,0,0,1
Why is a private limited company a good structure for a business?,1,0,0,0,1
Who is Apple's biggest shareholder?,0,0,1,0,1
Who now owns Apple?,0,0,1,0,1
What a limited company means?,1,0,0,0,1
What does private company mean?,1,0,0,0,1
Is a ltd a LLC?,1,0,0,0,1
Is Pty Ltd the same as LLC?,1,0,0,0,1
What WLL means?,1,0,0,0,1
What do you mean by dividend?,0,0,1,0,1
How does a PLC company work?,0,1,0,0,1
Are public companies listed?,0,1,0,0,1
What does it mean if a company is listed on the stock exchange?,0,1,0,0,1
Who owns a corporation?,0,0,1,0,1
What is meant by share of company?,0,0,1,0,1
Who owns LC?,0,0,1,0,1
What companies are privately owned?,1,0,0,0,1
What type of liability does a public limited company have?,0,1,0,0,1
Who are shareholders in a company?,0,0,1,0,1
Is your company publicly traded?,0,1,0,0,1
What does private unlimited company mean?,1,0,0,0,1
How many public limited companies are there in India?,0,1,0,0,1
What does it mean for a company to be limited by shares?,0,0,1,0,1
Do public limited companies have limited liability?,0,1,0,0,1
Is Google privately owned?,1,0,0,0,1
Who are the stakeholders in a business?,0,0,1,0,1
What is an investor in a business?,0,0,1,0,1
Is Cargill the largest privately owned company?,1,0,0,0,1
Is a listed company a public company?,0,1,0,0,1
Who are the owners of a limited company?,0,0,1,0,1
Can I add shareholders to my limited company?,1,0,1,0,1
How many shareholders does a limited company need?,0,0,1,0,1
How do shares work in a limited company?,0,0,1,0,1
Do shareholders get paid?,0,0,1,0,1
What rights do shareholders have in a limited company?,0,0,1,0,1
Can a director remove a shareholder?,0,0,1,0,1
Can you be a director without being a shareholder?,0,0,1,0,1
Can a company remove a shareholder?,0,0,1,0,1
Can I make my daughter a shareholder in my company?,0,0,1,0,1
How many shareholders can a private company have?,1,0,1,0,1
Who Controls Private Limited Company?,1,0,1,0,1
Can a child be a shareholder in a limited company?,0,0,1,0,1
Can I give shares to my son?,0,0,1,0,1
Can a 16 year old buy shares?,0,0,1,0,1
Who can hold shares in a company?,0,0,1,0,1
What is the maximum number of shareholders in a private limited company?,1,0,1,0,1
Can a privately owned company have shareholders?,1,0,1,0,1
Can a private company have more than 50 shareholders?,1,0,1,0,1
Can a 50 Shareholder remove a director?,0,0,1,0,1
Can shareholders be forced to sell shares?,0,0,1,0,1
What happens if a shareholder dies?,0,0,1,0,1
Is a shareholder an owner?,0,0,1,0,1
Can shareholders overrule directors?,0,0,1,0,1
Do shareholders really own the company?,0,0,1,0,1
Can a company sue a shareholder?,0,0,1,0,1
Can a 50 shareholder liquidate a company?,0,0,1,0,1
Can a shareholder be fired?,0,0,1,0,1
What are shareholders entitled to?,0,0,1,0,1
How do companies distribute profits to shareholders?,0,0,1,0,1
How do companies earn from shares?,0,0,1,0,1
At what age can you own shares?,0,0,1,0,1
Can I transfer shares to a family member?,0,0,1,0,1
Can you give away shares for free?,0,0,1,0,1
Can a child hold shares in a company?,0,0,1,0,1
How many shareholders does a limited company have?,0,0,1,0,1
How many directors can be in a limited company?,0,0,1,0,1
Who can be shareholders in a private limited company?,1,0,1,0,1
Who Cannot be a shareholder?,0,0,1,0,1
Can a trust become a shareholder?,0,0,1,0,1
Who is beneficial owner of shares?,0,0,1,0,1
How many shareholders should a private company have?,1,0,1,0,1
What rights do shareholders have in a private company?,1,0,1,0,1
Is a limited company a private company?,1,0,0,0,1
How many investors can a private company have?,1,0,1,0,1
What are ordinary shares in a limited company?,0,0,1,0,1
How do owners of a company get paid?,0,0,1,0,1
What percentage of profits go to shareholders?,0,0,1,0,1
Is a company obliged to distribute its annual profits?,0,0,1,0,1
Are shareholders entitled to full accounts?,0,0,1,0,1
What is the role of a shareholder in a limited company?,0,0,1,0,1
How many types of shareholders are there?,0,0,1,0,1
Does a limited company have to have shareholders?,0,0,1,0,1
How can I transfer shares in private limited company?,1,0,1,0,1
Are shareholders liable?,0,0,1,0,1
Can a private company have shareholders?,1,0,1,0,1
Who are the shareholders in a private limited company?,1,0,1,0,1
How many shareholders does a private limited company have?,1,0,1,0,1
How many shareholders are allowed in a private company?,1,0,1,0,1
Are shareholders liable for limited company debts?,0,0,1,0,1
What is the difference between limited and private limited company?,1,1,0,0,1
Can I sell my shares in a private company?,1,0,1,0,1
Is Ltd a private limited company?,1,0,0,0,1
Do private limited companies have shareholders?,1,0,1,0,1
Who owns a public company?,0,1,1,0,1
How do you find out who owns shares in a public company?,0,1,1,0,1
How many shareholders does a public company have?,0,1,1,0,1
Is a subsidiary of a public company also public?,0,1,0,0,1
Can a shareholder sell his shares to anyone?,0,0,1,0,1
Do shareholders own the company?,0,0,1,0,1
How can you tell who owns a company?,0,0,1,0,1
How do you find out shareholders of a company?,0,0,1,0,1
How do I find a company shareholder?,0,0,1,0,1
Is Amazon a public company?,0,1,0,0,1
Is public company a government company?,0,1,0,0,1
Is Apple a public company?,0,1,0,0,1
Shareholders' rights in private and public companies,1,1,1,0,1
Can I be shareholder of a limited company?,1,0,1,0,1
I want to become shareholder of a limited company.,1,0,1,0,1
Can I be shareholder of a limited public corporate?,0,1,1,0,1
Can my company be shareholder of a limited company?,1,0,1,0,1
Can my company be shareholder of a public corporate?,0,1,1,0,1
Kann ich Gesellschafter einer GmbH sein?,1,0,1,1,0
Wer kann Gesellschafter einer AG sein?,0,1,1,1,0
Kann ich mit meiner GmbH Mehrheitseigner einer AG sein?,1,1,1,1,0
Was sind die Gesellschafter einer GmbH?,1,0,1,1,0
Ist ein Geschäftsführer ein Gesellschafter?,0,0,1,1,0
Wie haftet ein Gesellschafter einer GmbH?,1,0,1,1,0
Was ist ein geschäftsführender Gesellschafter?,0,0,1,1,0
Was versteht man unter Stammeinlage?,0,0,1,1,0
Wer haftet bei GmbH & CO KG?,1,0,0,1,0
Wer ist der gesetzliche Vertreter einer GmbH?,1,0,0,1,0
Ist ein Gesellschafter ein Unternehmer?,0,0,1,1,0
Ist ein Aktionär ein Gesellschafter?,0,0,1,1,0
Ist ein Kommanditist ein Gesellschafter?,0,0,1,1,0
Was bedeutet Stammkapital bei GmbH?,1,0,0,1,0
Wie hoch ist das Stammkapital einer GmbH?,1,0,0,1,0
Kann das Stammkapital einer GmbH verwendet werden?,1,0,0,1,0
Was macht ein Aktionär?,0,0,1,1,0
Sind Aktionäre Eigentümer?,0,0,1,1,0
Ist eine GmbH eine juristische Person?,1,0,0,1,0
Was bedeutet GmbH & CO KG?,1,0,0,1,0
Wer ist Inhaber einer GmbH & CO KG?,1,0,0,1,0
Ist eine GmbH & Co KG eine juristische Person?,1,0,0,1,0
Wer haftet für die GmbH?,1,0,0,1,0
Was kostet es eine GmbH zu gründen?,1,0,0,1,0
Wie gründet man eine GmbH in Deutschland?,1,0,0,1,0
Was bedeutet es Gesellschafter zu sein?,0,0,1,1,0
Ist ein Gesellschafter ein Geschäftsführer?,0,0,1,1,0
Was braucht man alles für eine GmbH?,1,0,0,1,0
Wie lange dauert es eine GmbH zu gründen?,1,0,0,1,0
Was kostet es eine Mini GmbH zu gründen?,1,0,0,1,0
Wie haften Geschäftsführer einer GmbH?,1,0,0,1,0
Was ist eine UG gründen?,1,0,0,1,0
Was ist eine UG haftungsbeschränkt?,1,0,0,1,0
Was ist ein Musterprotokoll GmbH?,1,0,0,1,0
Was versteht man unter dem Stammkapital einer GmbH?,1,0,0,1,0
Was ist nötig um eine GmbH zu gründen?,1,0,0,1,0
Was sind die Vorteile einer GmbH?,1,0,0,1,0
Wie entsteht eine GmbH?,1,0,0,1,0
Was ist ein Gesellschafter in einer Firma?,0,0,1,1,0
Wer ist der Inhaber einer GmbH?,1,0,0,1,0
Was ist ein Minderheitsgesellschafter?,0,0,1,1,0
Was macht eine GmbH aus?,1,0,0,1,0
Kann eine GmbH von einer Person gegründet werden?,1,0,0,1,0
Wie viel Steuern zahlt eine GmbH?,1,0,0,1,0
Was ist ein Geschäftsanteil?,0,0,1,1,0
Hat eine GmbH eine Satzung?,1,0,0,1,0
Wer haftet bei der UG?,1,0,0,1,0
Was ist der Unterschied zwischen GmbH und UG?,1,0,0,1,0
Welche Steuern zahlt eine UG?,1,0,0,1,0
Was bedeutet eine UG?,1,0,0,1,0
Was ist eine UG eine Personengesellschaft?,1,0,0,1,0
Was gibt es für Gesellschaftsformen?,1,1,0,1,0
Welche Gesellschaftsformen?,1,1,0,1,0
Wie wird eine GmbH besteuert?,1,0,0,1,0
Welche Rechtsform hat eine UG?,1,0,0,1,0
Was bedeutet das Wort haftungsbeschränkt?,1,1,0,1,0
Hat eine GmbH einen Aufsichtsrat?,1,0,0,1,0
Wer sind die Gesellschafter einer AG?,1,0,1,1,0
Kann eine GmbH Gesellschafter in einer GmbH sein?,1,0,1,1,0
Hat die GmbH einen Vorstand?,1,0,0,1,0
Wer ist gesetzlicher Vertreter einer AG?,1,0,0,1,0
Wer bestimmt den Aufsichtsrat?,0,1,0,1,0
Wer haftet bei der AG?,0,1,0,1,0
Wer vertritt die AG?,0,1,0,1,0
Was sind die Organe einer GmbH?,1,0,0,1,0
Welche Rechte hat man als Aktionär?,0,0,1,1,0
Wie hoch muss das Grundkapital einer AG sein?,0,1,0,1,0
Wie setzt sich das Grundkapital einer AG zusammen?,0,1,0,1,0
Hat eine AG Gesellschafter?,0,1,0,1,0
Ist ein Aktionär Gesellschafter?,0,0,1,1,0
Wie nennt man Inhaber einer AG?,0,1,0,1,0
Wer ist der Geschäftsführer einer AG?,0,1,0,1,0
Was macht der Aufsichtsrat einer AG?,0,1,0,1,0
Was macht der Vorstand einer AG?,0,1,0,1,0
Was macht der Vorstand?,0,1,0,1,0
Was sind die Organe einer AG?,0,1,0,1,0
Was bedeutet Kooptierter Vorstand?,0,1,0,1,0
Was machen Aufsichtsräte?,0,1,0,1,0
Wann wurde die erste Aktiengesellschaft gegründet?,0,1,0,1,0
Was ist der Vorstand einer AG?,0,1,0,1,0
Ist eine Aktiengesellschaft ein Unternehmen?,0,1,0,1,0
Was ist die Dividende bei Aktien?,0,0,1,1,0
Ist eine AG eine Kapitalgesellschaft?,0,1,0,1,0
Was bedeutet ag und GmbH?,1,1,0,1,0
Ist Google eine Aktiengesellschaft?,0,1,0,1,0
